title,price,reviews,rating,company,customerreviews,primaryprice,brand,totalreviews
SNDIA Multicolor Keyring & Keychain(Pack Of 50), 99.00,112,4.3,SNDIA,4.3 out of 5 stars,,SNDIA,112 customer reviews
Sfk Replacement Remote Key Shell for Honda City (Below 2014) / Civic/Old Jazz/Mobileo/Brio/Amaze/CRV (for 2 Button Key), 349.00,87,3.9,SFK,3.9 out of 5 stars,,SFK,87 customer reviews
Generic Imported Aluminum Carabiner D-Ring Clip Hook Keychain Screw Locking - 54000182MG (Black), 89.00,52,3.6,Add-gear Generic,3.6 out of 5 stars,,Add-gear Generic,52 customer reviews
Generic 1oz Portable Stainless Steel Hip Flask Key Chain Silver, 200.31,9,4.1,Generic,4.1 out of 5 stars,,Generic,9 customer reviews
Kolossalz Double Ring Hook Keychain for car & Bike || Man & Boys Keyring (Golden Grey), 399.00,69,4.3,KOLOSSALZ own the excellence,4.3 out of 5 stars,,KOLOSSALZ own the excellence,69 customer reviews
DOCOSS- Pack of 2-Metal Antique Keychain for Men Stylish Or Girls Double Key Ring Hook Keychain Holder for Bikes Car Keychains & for Gift (Multicolor),,33,4.6,DOCOSS,4.6 out of 5 stars,,DOCOSS,33 customer reviews
Stanley 69-253 Hex Key Set (10-Pieces),,266,4.7,Stanley,4.7 out of 5 stars,,Stanley,266 customer reviews
Bulfyss Imported Multi-Purpose Mountain Bike Bicycle Repair Tool Kit Allen Key Spoke Wrench, 249.00,48,3.5,Bulfyss,3.5 out of 5 stars,,Bulfyss,48 customer reviews
CVANU Suzuki Full Metal Key Chain Key Rings For Suzuki Access 125 (Silver), 329.00,nan,nan,CVANU,,,CVANU,
"Sehaz Artworks Side Shelf Pocket Wooden Key Holder (25 cm x 11 cm x 0.3 cm, Brown)", 229.00,87,3.5,Sehaz Artworks,3.5 out of 5 stars,,Sehaz Artworks,87 customer reviews
Jaycoknit Men's Black Wheel Compass Metal Key Chain Ring,,12,3.8,Jaycoknit,3.8 out of 5 stars,,Jaycoknit,12 customer reviews
Smart iCards; 1 Retractable Steel Recoil Key Ring/ID Card Yo Yo Clip Silver + Black with Belt Clip, 170.00,15,3.6,Smart iCards,3.6 out of 5 stars,,Smart iCards,15 customer reviews
ATZ Silicone Key Cover for Maruti Baleno (Black), 99.00,143,4.5,ATZ,4.5 out of 5 stars,,ATZ,143 customer reviews
Generic Silver Royal Enfield Key Case, 105.00,22,3.8,Generic,3.8 out of 5 stars,,Generic,22 customer reviews
SPYCLOUD SF-3559 Car Key Spy Camera Model No.877979," 1,499.00",nan,nan,visionrabbit,,,visionrabbit,
Wish key Bullets for Toy Guns Set of 60, 299.00,11,4.6,Wish key,4.6 out of 5 stars,,Wish key,11 customer reviews
rijtus Whistle Sound LED Light Anti-Lost Alarm Key Finder Locator Keychain Device, 140.40,nan,nan,rijtus,,,rijtus,
Aai Silver Harry Potter Double Sided Inspired Hogwarts Key Case, 91.00,24,4.5,Aai,4.5 out of 5 stars,,Aai,24 customer reviews
"MADHULI Lord Krishna's Flute and Peacock Quills Zinc Key Holder for Home and Office,18.5x 6.0x1.5cm (Bronze)", 259.00,220,4.2,MADHULI,4.2 out of 5 stars,,MADHULI,220 customer reviews
Metal Double Keyring Hook Magnetic Compass Keychain (Golden Black Color), 184.00,80,3.2,Generic,3.2 out of 5 stars,,Generic,80 customer reviews
"KEYZONE Silicone Key Cover Fits for Verna, I20, Xcent Flip-Key Remote (Blue)", 249.00,102,3.6,KEYZONE,3.6 out of 5 stars,,KEYZONE,102 customer reviews
Amigozz Tag Label Keychain(Assorted) - Pack Of 50, 147.00,16,3.9,AmigozZ,3.9 out of 5 stars,,AmigozZ,16 customer reviews
Jaycoknit Red Spectre'S Fab 50 Year Metal Calendar Key Chain,,48,2.9,Jaycoknit,2.9 out of 5 stars,,Jaycoknit,48 customer reviews
GSK Allen/Hex Key Set of 9 Pieces - from 1.5 to10 mm, 120.00,2,4.5,GSK,4.5 out of 5 stars,,GSK,2 customer reviews
Smallall Batman Classic Logo Keychain (Silver), 95.00,88,4.0,SmallAll,4.0 out of 5 stars,,SmallAll,88 customer reviews
Pitzo Replacement Case 2 Button Remote Body Car Key Shell for Honda, 345.00,45,4.2,PITZO,4.2 out of 5 stars,,PITZO,45 customer reviews
"TIED RIBBONS Valentines Gifts for Wife, Husband, Girlfriend, Boyfriend, Special Gifts Combo (Printed Cushion (12"" X 12"") with Filler, Key Chain and Handmade Dark Chocolates)", 649.00,nan,nan,TIED RIBBONS,,,TIED RIBBONS,
Odestar Key Holder with Shelf -Wenge,,22,4.5,Odestar,4.5 out of 5 stars,,Odestar,22 customer reviews
visionrabbit Imported from Taiwan SF-3559 Car Key Spy Camera," 3,199.00",nan,nan,visionrabbit,,,visionrabbit,
KKRONAS Premium Silicon Key Cover for Tata Nexon/Tata Harrier (1 pcs.), 199.00,1,4.0,KKRONAS,4.0 out of 5 stars,,KKRONAS,1 customer review
VB Retail Silver Royal Bullet Bike Keyring & Keychain, 84.00,23,3.7,VB Retail,3.7 out of 5 stars,,VB Retail,23 customer reviews
The Krishna Key: Book 3 in the Bharat Series of Historical and Mythological Thrillers,,641,4.1,"
                
                
                
                    
                    
                        
                        by
	
    
    
        
        
        
            
        
        
        	
        	
    	

		
		
			",4.1 out of 5 stars,,"
                
                
                
                    
                    
                        
                        by
	
    
    
        
        
        
            
        
        
        	
        	
    	

		
		
			",641 customer reviews
"A10 Shop Omega 1 Wood Wall Mounted Key Holder with Decor Shelf (Wenge, 21x12x15cm)", 599.00,167,4.3,A10 Shop,4.3 out of 5 stars,,A10 Shop,167 customer reviews
"Exclusivelane 'Birds On Planks' Warli Hand-Painted Wooden Key Holder For Wall Decor In Sheesham Wood,(6 Hooks)", 839.00,54,4.4,ExclusiveLane,4.4 out of 5 stars,,ExclusiveLane,54 customer reviews
Jaycoknit Apple-Pie Metal Collectible Premium Silver Key Chain & Keyring,,22,4.1,Jaycoknit,4.1 out of 5 stars,,Jaycoknit,22 customer reviews
WINTECH Cable Key Lock for Bike Cycle Helmet Luggage (Black), 199.00,134,3.1,WINTECH,3.1 out of 5 stars,,WINTECH,134 customer reviews
Key Case Chain (Multicolor), 99.00,50,3.2,,3.2 out of 5 stars,,,50 customer reviews
Techpro Black Batman Begins Black Muscle Car Design Key Cases, 170.00,14,4.2,Generic,4.2 out of 5 stars,,Generic,14 customer reviews
PITZO Replacement 3 Button Remote Front Body Flip Car Key Shell/Case/Body For Centre Locking For Mahindra XUV500, 360.00,21,3.7,PITZO,3.7 out of 5 stars,,PITZO,21 customer reviews
TUFFSTUFF American Styletan Brown Leather Keychain, 389.00,151,3.0,TUFFSTUFF,3.0 out of 5 stars,,TUFFSTUFF,151 customer reviews
CORSAIR K55 RGB Gaming Keyboard - Quiet & Satisfying LED Backlit Keys - Media Controls - Wrist Rest Included - Onboard Macro Recording," 3,499.00",20,4.7,Corsair,4.7 out of 5 stars,,Corsair,20 customer reviews
PITZO Replacement 3 Button Remote Front Body Flip Car Key Shell/Case/Body For Centre Locking For Mahindra XUV500, 360.00,21,3.7,PITZO,3.7 out of 5 stars,,PITZO,21 customer reviews
Wish Key High Speed Beyblade Metal Fusion Set With Launcher For Kids - Multi Color, 460.00,25,3.5,Wish key,3.5 out of 5 stars,,Wish key,25 customer reviews
"HeavenlyKraft Metal Lord Krishna with Flute Key Holder Cabinet (Black, Standard Size)", 399.00,13,4.7,HeavenlyKraft,4.7 out of 5 stars,,HeavenlyKraft,13 customer reviews
Brasil Crest Keyring, 619.00,nan,nan,Brasil,,,Brasil,
SEPAL Leather Keychain Key Holder Ring Key Pouch Wallet Case with 6 Hooks Snap Closure for Men Women 10 x 6 cm Brown, 229.00,2,4.0,Sepal,4.0 out of 5 stars,,Sepal,2 customer reviews
"Kemflo PP Spun PreFilter Cartridge For RO/UV Water Purifier Size 10"" Pack Of 16 With 10"" Key", 709.00,nan,nan,XISOM,,,XISOM,
"spydo Keychain Camera,HD Sound Quality, 32GB Memory Supportable Audio/Video Recording Model No.8771000"," 1,499.00",nan,nan,visionrabbit,,,visionrabbit,
KEYZONE Silicone Key Cover for Elite i20/Active/Creta Flip Key Remote (Blue), 299.00,162,3.7,KEYZONE,3.7 out of 5 stars,,KEYZONE,162 customer reviews
"Lepose Durable Plastic Letterbox for Home, Gate, Office, Wall, Apartment, Banglow, Villas with 2 Keys in Red & White Colour (305mm X 260 mm X 95mm)", 590.00,1,4.0,Lepose,4.0 out of 5 stars,,Lepose,1 customer review
XCSOURCE 2pcs Signal Blocking Bag Car Key Keyless Entry Fob Guard Case Antitheft Protector Credit Card Phone Privacy Protection Pouch HS1183, 608.00,1,5.0,XCSOURCE,5.0 out of 5 stars,,XCSOURCE,1 customer review
"SPYCLOUD Keychain Camera,HD Sound Quality, 32GB Memory Supportable Audio/Video Recording Model No.877908"," 1,299.00",nan,nan,visionrabbit,,,visionrabbit,
"H & S Designer Studio Suzuki Silicone Key Cover for New Dzire, Ertiga & Swift (2018+) Push Smart Key (2Button) - Black",,2,5.0,"H & S DESIGNER STUDIO ""GREAT QUALITY BETTER PRICE""",5.0 out of 5 stars,,"H & S DESIGNER STUDIO ""GREAT QUALITY BETTER PRICE""",2 customer reviews
SFK Silicone Flip Key Cover for Volkswagen Polo/Vento / Jetta/Passat Flip Keys (VW 3 Button Flip Keys), 249.00,76,3.9,SFK,3.9 out of 5 stars,,SFK,76 customer reviews
Godrej Nav-Tal 7 Levers 4 Keys Padlock, 615.00,114,4.1,Godrej,4.1 out of 5 stars,,Godrej,114 customer reviews
DOCOSS -Large Size XL Hidden Secret Book Safe Vault Box with 2 Keys Jewelry Money Cash Box Locker Jewellery Home Safe Box Dictionary for Office Home (Assorted Color),,9,4.1,DOCOSS,4.1 out of 5 stars,,DOCOSS,9 customer reviews
50Pcs Double Sided Multi Color Key Chain, 169.00,2,4.5,Generic,4.5 out of 5 stars,,Generic,2 customer reviews
Essart Sarvika Collection Brown Keychain (KH-41410-Brown), 449.00,5,4.0,Essart,4.0 out of 5 stars,,Essart,5 customer reviews
AlexVyan Imported 16 Function Cycle Tool Kit Multi Purpose Mountain Bike Bicycle Repair Tool Kit Allen Key Spoke Wrench, 248.00,nan,nan,Alexvyan,,,Alexvyan,
Generic Phenovo Alloy Metal Key Chain Double Ring Key Ring Holder Car Keychain, 220.00,16,3.2,Generic,3.2 out of 5 stars,,Generic,16 customer reviews
Key Words 1a: Play with Us,,33,4.4,"
                
                
                
                    
                    
                        
                        by
	
    
    
        
        
        
            
        
        
        	
        	
    	

		
		
			",4.4 out of 5 stars,,"
                
                
                
                    
                    
                        
                        by
	
    
    
        
        
        
            
        
        
        	
        	
    	

		
		
			",33 customer reviews
"SPYCLOUD Keychain Camera,HD Sound Quality, 32GB Memory Supportable Audio/Video Recording Model No.877982"," 1,299.00",nan,nan,visionrabbit,,,visionrabbit,
Rrimin Leather Black Key Case,,46,3.7,Rrimin,3.7 out of 5 stars,,Rrimin,46 customer reviews
"Dot & Key Skin Awakening Moisture Boost Face Serum, Vitamin C, B3, E, Argan Oil and Shea Butter Face Serum For Glowing Skin - Paraben Free",,14,3.7,Dot & Key,3.7 out of 5 stars,,Dot & Key,14 customer reviews
RaJ Royal Enfield (Bullet) Bike Leather Key Chain Key Ring (Brown), 228.00,1,5.0,Raj,5.0 out of 5 stars,,Raj,1 customer review
Sehaz Artworks Letter-Box-WT-KeyHolder Wooden Key Holder (7 Hooks), 399.00,nan,nan,Sehaz Artworks,,,Sehaz Artworks,
Loopan USB Rechargeable Moon Light Keychain Emergency Led Torch Waterproof, 265.00,44,3.7,LOOPAn,3.7 out of 5 stars,,LOOPAn,44 customer reviews
Madhuran Display 7 Hook Wall Mounted Wooden Key Holders with Shelf Wenge/Decorative Multipurpose Hanging Rack,,6,4.8,Madhuran,4.8 out of 5 stars,,Madhuran,6 customer reviews
"Taslar Pubg Keychain Set Level 3 Backpack,Frying Pan, Helmet, 98K Gun Armor 3D Pendant Key Chain Playerunknown's Battlegrounds (Combo of 5)",,4,3.4,TASLAR,3.4 out of 5 stars,,TASLAR,4 customer reviews
Strontium Ammo 16GB 2.0 USB Pen Drive (Silver), 397.00,895,4.1,Strontium,4.1 out of 5 stars,,Strontium,895 customer reviews
MJ TRADERS KHAN Silicone Key Cover for Mahindra Bolero Flip Keys (Black),,nan,nan,MJ TRADERS,,,MJ TRADERS,
Indira Designer Silk Saree with Blouse Piece, 434.00,8,3.8,Indira Designer,3.8 out of 5 stars,,Indira Designer,8 customer reviews
Essart Sarvika Collection Black Keychain (KH-41410-Black), 499.00,4,4.2,Essart,4.2 out of 5 stars,,Essart,4 customer reviews
MJ TRADERS KHAN Silicone Key Cover for Mahindra Bolero Flip Keys (Black),,nan,nan,MJ TRADERS,,,MJ TRADERS,
"RRPURE Prefilter Housing Bowl Filter + PP Spun Filter + 3 Mtr Pipe + Tefflon Tape + 1/4"" Nosel & Spanner Key for RO Water Purifier", 449.00,nan,nan,RRPURE,,,RRPURE,
